{
 "id": "arcanist_hoarfrost",
 "name": "Hoarfrost Regalia",
 "description": "The Arcanist's default look (G-08): a deep pointed hood with a dark lining over a mantle, two capelets with a collar of glowing ice crystals, a wrap-front robe with drooping bell sleeves and a torn hem, a knotted sash with an ice pendant, wrapped fingerless gloves, an ankle-length torn underskirt over trousers, soft boots, and a long cape hung with icicles.",
 "armor_type": "cloth",
 "default_for": [
  "arcanist"
 ],
 "pieces": {
  "head": {
   "design": "arcanist_hood",
   "name": "Hoarfrost Hood",
   "tris": 12000,
   "texture_size": 4096,
   "hides": [
    "hair"
   ]
  },
  "shoulders": {
   "design": "arcanist_capelet",
   "name": "Hoarfrost Capelet",
   "tris": 10000,
   "texture_size": 2048
  },
  "chest": {
   "design": "arcanist_robe",
   "name": "Hoarfrost Robe",
   "tris": 24000,
   "texture_size": 4096
  },
  "hands": {
   "design": "arcanist_wraps",
   "name": "Hoarfrost Wraps",
   "tris": 8000,
   "texture_size": 2048
  },
  "waist": {
   "design": "arcanist_sash",
   "name": "Hoarfrost Sash",
   "tris": 3000,
   "texture_size": 2048
  },
  "legs": {
   "design": "arcanist_underskirt",
   "name": "Hoarfrost Underskirt",
   "tris": 12000,
   "texture_size": 4096
  },
  "feet": {
   "design": "arcanist_boots",
   "name": "Hoarfrost Boots",
   "tris": 6000,
   "texture_size": 2048
  },
  "back": {
   "design": "arcanist_frost_cape",
   "name": "Hoarfrost Cape",
   "tris": 8000,
   "texture_size": 2048
  }
 },
 "dyes": {
  "arcanist_rime": {
   "primary": "#2d4a6b",
   "secondary": "#c9d6e2",
   "metal": "#8a96a3"
  },
  "default": {
   "primary": "#2d4a6b",
   "secondary": "#c9d6e2",
   "metal": "#8a96a3"
  }
 }
}