{
 "id": "warblade_ironreaver",
 "name": "Ironreaver",
 "description": "The Warblade's default look (G-07): massive angular blackened plate with brass trim. A close helm with a T-shaped opening and wide ribbed horns over a plate gorget, spiked angular pauldrons, a keeled cuirass and plackart over mail, heavy gauntlets with spiked knuckles, a studded girdle with a steel boss, tassets, cuisses, spiked knee cops and greaves, pointed sabatons, and a war cloak torn into strips under a fur ruff.",
 "armor_type": "plate",
 "default_for": [
  "warblade"
 ],
 "pieces": {
  "head": {
   "design": "warblade_horned_helm",
   "name": "Ironreaver's Horned Helm",
   "tris": 12000,
   "texture_size": 4096,
   "hides": [
    "hair",
    "beard",
    "face"
   ]
  },
  "shoulders": {
   "design": "warblade_pauldrons",
   "name": "Ironreaver's Pauldrons",
   "tris": 10000,
   "texture_size": 2048
  },
  "chest": {
   "design": "warblade_cuirass",
   "name": "Ironreaver's Cuirass",
   "tris": 24000,
   "texture_size": 4096
  },
  "hands": {
   "design": "warblade_gauntlets",
   "name": "Ironreaver's Gauntlets",
   "tris": 8000,
   "texture_size": 2048
  },
  "waist": {
   "design": "warblade_girdle",
   "name": "Ironreaver's Girdle",
   "tris": 3000,
   "texture_size": 2048
  },
  "legs": {
   "design": "warblade_legplates",
   "name": "Ironreaver's Legplates",
   "tris": 12000,
   "texture_size": 4096
  },
  "feet": {
   "design": "warblade_sabatons",
   "name": "Ironreaver's Sabatons",
   "tris": 6000,
   "texture_size": 2048
  },
  "back": {
   "design": "warblade_war_cloak",
   "name": "Ironreaver's War Cloak",
   "tris": 8000,
   "texture_size": 2048
  }
 },
 "dyes": {
  "warblade_carnage": {
   "primary": "#5a1d18",
   "secondary": "#a8803c",
   "metal": "#474a51"
  },
  "default": {
   "primary": "#5a1d18",
   "secondary": "#a8803c",
   "metal": "#474a51"
  }
 }
}